text,category,label,proportionEnglish
Siddiqui and Rajni sir sambalpuri music superhit,Positive ,2,0.42857142857142855
ROCKING STAR YASH fans hit like here,Positive ,2,0.7142857142857143
Niraya Niraya Niraya Sema,Positive ,2,0.0
Munnadi thamilda hindi ppl copy pannath ippo ulta aayidichaa,Mixed_feelings ,1,0.1111111111111111
Oruthar mel ningga visvasam katerethekage innoruthare yen asinge padetheringe,Positive ,2,0.2222222222222222
My dear 47k dislikers RIP verithanam varatum anga papom,Positive ,2,0.3333333333333333
1 31 yaarukaachu asuran padam niyabgathuku vanthucha,Positive ,2,0.0
Bayagarama kathuvanga aamaians indha trailer paththu,Positive ,2,0.16666666666666666
silaiya odaikalam ana avaga sithandha odaika mudiyadhu Periyar ambedkar U1 PS SIVA Grand Blockbuster hit,Positive ,2,0.3333333333333333
Dai Ranjith naaye ithu thaanda yenga thalaivar un caste kaaga thalaivar ra spoil Panna paatha,Positive ,2,0.26666666666666666
Theeran movie fans hit likes,Positive ,2,0.4
Dislike pannunavanla trailor ku pannala thala ku pannirukkanunga,Mixed_feelings ,1,0.125
Seems like mission impossible Tom cruise,Negative ,0,0.6666666666666666
Marana Waiting Thalaiva Makkal Selvan,Positive ,2,0.2
Vikram look like Bryan in Tekken game,Negative ,0,0.7142857142857143
dai thala pera sonnalay summa tamil naday athirum daa,Positive ,2,0.0
Trailer ivolo kavalom padam Roma kavalom,Positive ,2,0.16666666666666666
andrala nama tamil peoples ah thappa pesunavan thana chai apave ivan mela mariyathai pochi,Positive ,2,0.2857142857142857
Yow mass yah Kandipa theater la 3d odatha paapa,Positive ,2,0.5555555555555556
Shangar Sir ungalukku Thalapathi Fans Support Eppavm Erukkum,Positive ,2,0.25
from 1 33 to 1 50 semma massssssss,Positive ,2,0.25
Vijay sethupathiya nambathingaya avar movie ya aagidum climax la Vjs parak,Positive ,2,0.36363636363636365
Ithu kandit chinthamani kolakes pole thoniya malayalikal undoo,Negative ,0,0.125
Vijay sethupathi kaga indha trailer parthavanga la naanum oruvan,Negative ,0,0.2222222222222222
I m big fan of dhanush,Positive ,2,1.0
Thala love you Yuvan bgm mass,Positive ,2,0.5
enna padam yaa kola mass 3,Positive ,2,0.3333333333333333
intha pongal sema super ah iruka pothu,Positive ,2,0.2857142857142857
Enda potti pottu dislike panreenga haters,Negative ,0,0.16666666666666666
Unga mass yappo vooo engalukku theriyum,Negative ,0,0.16666666666666666
Thalaaivaa i love you hand sign i love you hand sign Thalapathy Fans Like Hey call me hand call me hand,Positive ,2,0.8571428571428571
Vada Chennai 2 ku wait panravanga hit likes,Negative ,0,0.25
Ennanga da views crash aiirucha romba neram ah appdiyae nikkidhu thinking face thinking face,Positive ,2,0.5
Isaac Asimov photo vechi irukkinga semma,Mixed_feelings ,1,0.16666666666666666
Epdiyae ellarayum konnuptu neeyum seththu poidu,Positive ,2,0.0
Trending 1st varani thukuthorai thuku potu savano,Negative ,0,0.0
Namma kitta erndhu padipa matu aduthuka mudiyadhuMass thalaiva nee,Positive ,2,0.1111111111111111
Sathiyan Sooriyan is brighest man as his name,Positive ,2,0.625
43k dislikes katharals avalovu bayama,Negative ,0,0.0
Ooooowh thalaa vera level thalaa Nngaa Lovely my god,Positive ,2,0.5555555555555556
Thalaivaa Mass Thalaivaa Seeman Jatti poduvaana Ilaiyanu teriyalaiyeh,Mixed_feelings ,1,0.125
Tharaamaaa Movie Athulaa yanthaa oru Matruuu Karuthum ilaiii Athuu Mattum uruthii,Mixed_feelings ,1,0.09090909090909091
All the best Ajith SIR Pink was outstanding So does Neerkonda Paarvai,Positive ,2,0.75
Manju looks like Kanmadham character exploding head shocked face with exploding head exploding head shocked face with exploding head,Negative ,0,0.5263157894736842
Graphics sari illa nu solrathukune oru gang suthum parunga,Positive ,2,0.4444444444444444
Ithu pol movie Ku nandri vetri Maran and dhanush,Positive ,2,0.4444444444444444
It seems to be look like mahalakshmi movie in telugu,Positive ,2,0.7
Yarellam indha padatha pathutu andha impact la irundhu veliya varala,Positive ,2,0.2
Padam vera level dhanush vettri brilliant must watch,Positive ,2,0.75
70 looks like Rohit shettys Dilwale,Negative ,0,0.16666666666666666
Marana waiting July 19 on big screen Chiyaanism,Positive ,2,0.5
Vanga da unite panni intha trailer 1milion likes kondavaruvom,Negative ,0,0.3333333333333333
kolla kandulaya irukeran sun tv melaya padathai sekiram release pannu,Negative ,0,0.2
840k likes 77k comments 15 million views night kulla varanum,Positive ,2,0.2
Enna Pathi Teriyanumna Nee Innum Konjam Kathirukkanum well said kathirukkom thalaivare waiting for you Only,Positive ,2,0.4666666666666667
4 11 am yarachu erukingala like podunge,Positive ,2,0.2857142857142857
VJ s unaku thaan dance varalala makka kelanguthappa oda niruthika vendiythu thane,Negative ,0,0.3333333333333333
Blockbuster nu nenaikuravanga like podunga,Mixed_feelings ,1,0.6
Nice Trailer But Dhool Padam Maathiri Irukumonu Oru Chinna Doubt Vera Yaarkavathu Intha Doubt Vanthrukaa,Mixed_feelings ,1,0.4
Ivalom mokka movie naa ithu vare pakkale,Positive ,2,0.42857142857142855
Intaa pongal talaivaru taa apidinu sollrava ellam like panungaa,Positive ,2,0.2222222222222222
Dislike poravanla Ratham Kakki than saavan,Negative ,0,0.3333333333333333
nkp fails to break mersal sarkar teaser,Positive ,2,0.5714285714285714
Thala sema mass waiting for 1m likes,Positive ,2,0.42857142857142855
Vikaram Vera level by Surya Anna fan,Positive ,2,0.7142857142857143
This copy story Giri movie Konjam kuda matram ilaaa,Mixed_feelings ,1,0.4444444444444444
Chiyan vikram nu name yai triler la varala,Positive ,2,0.375
I love u anna Ajith kumar,Positive ,2,0.6666666666666666
Vera level thalaivaaa GV Sir Music therikuthuuuu,Positive ,2,0.5714285714285714
Energy level super rajinikanth gurava the horns sign of the horns the horns sign of the horns,Positive ,2,0.6470588235294118
0 44 intha bgm kekum bothalam pullarikithu,Positive ,2,0.0
One time ku mela trailer paathavanga koocha padaama like pannunga,Positive ,2,0.5
Seekirama 10M views Vara vainga Good night solanum,Positive ,2,0.5
Thala pakka mass padam vera vera vera levelaa irukka pokuthu adichu thookku,Positive ,2,0.3333333333333333
Anna ne vera vera vera level na,Positive ,2,1.0
dude thala ku role suit aagala not like amitab bachan,Mixed_feelings ,1,0.5
Singapore m tranding no 1 Wow,Positive ,2,0.5
Bigil update vidura time la hugging face hugging face trailer release panna paathiya,Positive ,2,0.6923076923076923
Our t64 director vera level,Mixed_feelings ,1,0.8
Super star rajni kanth sir king in cinema,Positive ,2,0.75
Sema mass thalaivaaa Thank u karthiksubburaj sir,Positive ,2,0.5714285714285714
All thala fans like pottingla,Positive ,2,0.4
Raani anaa god is tamil telugu cinema,Positive ,2,0.42857142857142855
Outright disaster much like sketch and vaalu,Negative ,0,0.8571428571428571
Ah BGM Veri Yaethuthu,Positive ,2,0.5
Sathiyama Vera leval thala nad yuvan musical,Positive ,2,0.2857142857142857
730k likes reached aairuku pangalingala adichi thookalamaa ‍‍‍‍‍‍‍,Negative ,0,0.0
Apdi la nadakathu Nadakavum kudathu 1 33 Aphaaa veral level Thalaiya rmb naal ku aprma kovama screen la pakran,Positive ,2,0.21052631578947367
Marana mass da Thalaivar lub,Negative ,0,0.4
Edai la Ajith sir vantha mari irruku,Mixed_feelings ,1,0.2857142857142857
Thala naa Mass Thala naa Class,Positive ,2,0.6666666666666666
Yogi babu koko 500k Super star rajinikanth ku 374k tha thu thu entha vayasula ethu thavaiya da,Mixed_feelings ,1,0.4117647058823529
Pandey nadikiraru edhukku thae thanthi channel vitu ponigala,Positive ,2,0.125
Trending no 2 in Malaysia and Singapore Thala no 1,Positive ,2,0.4
inga ore oru super star dhan adhu enga thalaivar mattum dhan,Negative ,0,0.45454545454545453
Oruthar mela viswasam katurathukaga mathavangala enn asinga paduthuringa final dialogue semma ellarukum purium nu nenakiren,Positive ,2,0.26666666666666666
Avara control panunga plz thalaiya yaralayum control pana mudiyadhu ra vena,Positive ,2,0.2727272727272727
Nalla kadhai erukra padathuku lam trailer ku ivlo alaparai ila edo cartoon kadhai eduthu vechutu ayyayoo,Mixed_feelings ,1,0.1875
oh my God akhsay sir super,Positive ,2,0.8333333333333334
thalivya rajnii Anna style like cheyendii,Positive ,2,0.5
sweet laam pathathu pongale vachiruvom va,Positive ,2,0.16666666666666666
Yeppa Enna screen presence Oru vela pei padama irukumo,Positive ,2,0.3333333333333333
ungalukku vayase agala sitty love u ma,Positive ,2,0.42857142857142855
Padippa yaaralyum parika mudiyathu thaan aana Vela kedaikunum la,Negative ,0,0.2222222222222222
775k likes just 25k to 800k Thala fans come on,Positive ,2,0.4
Love from Japan I love Rajnikanth Amirkhan jr Ntr and Prabhas,Positive ,2,0.5454545454545454
Eppa paaru violence vettu adodjadi idhellam illama oru padam eduthu jeyichi laatunga young generationa violencelaya oora vachidadheenga,Mixed_feelings ,1,0.11764705882352941
Trailer Nlam Nalla Dhan Iruku Padam Oduna Pothum Chiyaan My FaV,Positive ,2,0.2727272727272727
Many many many many many,Positive ,2,1.0
Verithanam vere level Love u vetrimaran sir,Positive ,2,0.5714285714285714
Trending lla vanthachu eppa parunga da Petta paraakkkkkk,Positive ,2,0.125
Good wrk team but i hate rajani sir,Mixed_feelings ,1,0.75
Daivu seidhu asuran koodamattum release pannatheenga apparam panam poachu na Onnum sollamudiyaathu,Positive ,2,0.16666666666666666
Yenna padaipuya vaazhkaila paatha sirandha padaipuya idhu padamilla idhoeda thaakam poegala,Positive ,2,0.0
Pirabu and naasar very good acting in Piriyanka tamil movie But aigth and Pandey moka acting,Negative ,0,0.5625
khatarnak awesome i love it,Positive ,2,0.8
Yow Ennayaa pandringa Ithu kuda views varalana paravaala Remake movie trailer one line Storynu Accept pannalam,Positive ,2,0.4375
2 01 min Rajni changing as Akshay Kumar Twist,Positive ,2,0.3333333333333333
Sema trailer Neelam eppdi da mela vantha VJS atha keela irukkuravinga kitta kelu da,Positive ,2,0.2857142857142857
20 times pathuta thalaivaa evalo times pathalum pathute irukalamnu thonuthu,Positive ,2,0.2
Padippu padippu nnu solrangale Ethanae pearku idhu arasiyal reediya puriyudhu Parippe vitte nee kette,Positive ,2,0.14285714285714285
My birthday ku release so kandippa ethugagavey paaapa,Mixed_feelings ,1,0.5
Thala pola varuma Thala eppavume mass Vera level,Positive ,2,0.375
Thala sema maassss solla varthaye illa,Positive ,2,0.0
thank u so much ennoda 2 thalaivargalaiyum onna pakkurathukku மக ிழ்ச்சி,Mixed_feelings ,1,0.36363636363636365
pppaaaa enna dialogue delivery 68 vayasada idhu,Positive ,2,0.2857142857142857
Yar ellam vaanillrul NKP first single Update apram trailer pakka vandhu irukinga,Positive ,2,0.4166666666666667
2 padam ranjith ta kuduthu nasam pantaga but now decision turns into right,Positive ,2,0.5384615384615384
Thala love u thala love u so much thala niriya niriya dialogue,Positive ,2,0.5833333333333334
I m thalapathy fan romba nal kalichuu thala kku nalae padam varaee podhuuu manasukku ipodhaa sandhosamahhh irukkuuuu,Positive ,2,0.17647058823529413
Tharamana padam from thalaivar kartik suburaj anirudh ponggal ku mathe padam lam konjom othingiru odi pathingiru vararthu thalaivaru,Positive ,2,0.1111111111111111
Thalaiva trailer la pathittom kaaliyoda aattatha pathittom merandu poie irukkom inum on screen pakka wait panntrom thalava,Positive ,2,0.29411764705882354
RIP surjith,Negative ,0,0.5
Dark la ye niraya scenes varuthey,Positive ,2,0.5
Super Enga Thala pakka mass cfrm vera leve,Positive ,2,0.375
Super star super star tha masssss,Positive ,2,0.8333333333333334
Pakathana pora intha kaalioda atatha Petta parak,Positive ,2,0.0
Trailer semma ah irrukku Thala mass,Positive ,2,0.5
thalivaa nee eppoo vumay mass than thalivaa,Mixed_feelings ,1,0.42857142857142855
Enadha na Thalapathy fan ah irunthalum Thala ya pidikum,Mixed_feelings ,1,0.4444444444444444
Ranjith bro pathukunga ipdi tha superstar padam irukanum,Mixed_feelings ,1,0.125
Massukku porundhura patthu poruthamum unkittadha iruku ungakitta mattomdha iruku thalaivan DA,Positive ,2,0.09090909090909091
0 16 indha scene ah inu mathave ilaya Idhu magic da scientific illa But amy Iruku edho onnu namakaga kaathirukku,Mixed_feelings ,1,0.35
Inda trailer 1m lifetime likes kuda vaangadhu polaa,Positive ,2,0.25
Boss super star is back in avatar,Positive ,2,0.8571428571428571
Rajni RockS By Fan of Rajni S Tendulkar,Negative ,0,0.5
Pacha thewdiya mavan rasini Nalla Jalra Adinga da TN Naaingala,Negative ,0,0.1
U1 BGM massssssss verala level thala look semaaaaaa,Positive ,2,0.25
Yaarella Tee Jay note panigeh fans oru like podungeh star struck star struck grinning face with star eyes star struck star struck grinning face with star eyes,Positive ,2,0.7407407407407407
omg ragini sir was in darjelling,Mixed_feelings ,1,0.5
Ar Rahman music super sama masssss,Positive ,2,0.5
Yuvan bgm world class level hit like,Positive ,2,0.7142857142857143
Indha padam nalla irukkum Ana thalapathy 64 mayiru madiri irukkum hit like,Positive ,2,0.25
Ram Charan s new trailer 215k likes over 5 6M views petta 428k likes over 5 6M views swag level of rajni sir,Positive ,2,0.43478260869565216
Appadi ea intha pad man tare zameen par itha remake pannuga ippo irruka suitivation ku adopt ah irrukum,Positive ,2,0.4444444444444444
Yuvan thala deadliest combo Dialogues bgmyuvannnthalaaaaaa,Positive ,2,0.0
BABL Thala AJITH in serapana Movie vazthkal,Positive ,2,0.2857142857142857
You are lying lying lying lying,Positive ,2,1.0
Marana mass thalaiva atuchi thulpannu thalaiva,Positive ,2,0.16666666666666666
1 59 2 02 vasigaran turns into Akshay,Mixed_feelings ,1,0.25
Guys Ellarum Lyrics song commentuku vaanga Katharalgal roba athigama irukku katharikitte irukanuga,Positive ,2,0.08333333333333333
Movie paaththiddu tailer pakravangka like podungka,Positive ,2,0.5
August 10 tharamana sambavam iruku kathiruppom,Positive ,2,0.16666666666666666
Akshay Kumar ku bathila Siva Kumar ah potrukanum thappu pannitanga,Mixed_feelings ,1,0.2
Thalaiver padam vetri adaiya thalaiyin rasikarkalin vaalthukkal,Positive ,2,0.0
Intha trailer trending nu soldravanga oru like ting ting panugo,Positive ,2,0.5
Ita yavudu release panna udunga ya,Positive ,2,0.3333333333333333
Saaho oda remix ah shakthi man ah,Mixed_feelings ,1,0.7142857142857143
End Fight Vere level,Positive ,2,0.75
Thoongi Enthiracha vudane evlo million views nu paka vanthavanga like podunga,Positive ,2,0.2727272727272727
Style ah irukeenga athu natural ena word ya Athu,Positive ,2,0.5555555555555556
Self made superstars in India rajini kanth chiranjeevi amitabhachan,Positive ,2,0.3333333333333333
Manju warrier Vadachennai Andriya vuku duff kodupanga pola,Positive ,2,0.125
Looks like good but engeyoo lag agramadiri irukku papom,Mixed_feelings ,1,0.4444444444444444
N k p no 1 trending you tup srilanka thala pakka mass,Positive ,2,0.5833333333333334
Trailer Ra ore varthaiyil sollanuna Gommala trailer appadi Rikki,Positive ,2,0.4444444444444444
Thalaaaaaa nee vaa thaaaalaaa senjivitruvom,Positive ,2,0.2
Semme mokka doi ha ha ha kubeer nu sirichavan ellam kai thooku,Positive ,2,0.4166666666666667
Theriiiiiiiiiii maxxxxxxx Best wishes from thalapathy fans,Positive ,2,0.2857142857142857
sweet sapda porom vera evan soli irundalum ivlo mass ah irundirukaadhu the name is SUPER STAR,Positive ,2,0.625
Oruthavanga mela ulla Viswasatha kaatta innoruthavangala Asingapadutha koodathu Semma Line,Positive ,2,0.3
Our Lady Super Star Manju Warrier,Positive ,2,0.6666666666666666
After infinity war ungaa trailer kudaa pakka pudikalaa,Negative ,0,0.5
hahahha bilgil kitten modate venna kaithi patukooo,Positive ,2,0.14285714285714285
Vetri maaran Dhanush Is best,Positive ,2,0.6
Next vijay movie logesh kanagaraj kooda dhan da Apo yar gethu Nu yosi,Positive ,2,0.46153846153846156
Ippadi neraya neraya neraya neraya Thala fans From Malaysia,Positive ,2,0.1111111111111111
Trailer partaale terithu next year Thalapathy64 epdi irukum nu veritthannnaam,Positive ,2,0.4
Thalapathy 64 Ku Wait Pandravan Like Adi,Positive ,2,0.2857142857142857
Ennagada 3naal appram ternding lla variga,Positive ,2,0.0
Vera level super star Ragini fans like hit,Negative ,0,0.75
Yuvan Vera level thala ne,Positive ,2,0.6
Rangraj Pandey Ennaya Pandra Court la Over aah Pesuna Court aah Vittu Kuda Thorathida Poranga face with hand over mouth smiling face with smiling eyes and hand covering mouth face with hand over mouth smiling face with smiling eyes and hand covering mouth,Positive ,2,0.6976744186046512
Hahaha back to 90s rajini sir Waiting thalaivaaa,Positive ,2,0.5
Bigil oobittu pooga vendiya neeram vandhuruchu,Negative ,0,0.0
Padam verti para thalapathy fans sapaka vailthukail,Positive ,2,0.14285714285714285
Thalai awesome Vera level Vaa thalaivaaaaaaaa,Positive ,2,0.5
I am first like and viewer,Positive ,2,1.0
Yuvan bgm vera level paaa grt composer,Positive ,2,0.42857142857142855
Super star is back Pakka blockbuster thank u karthik subbaraj,Positive ,2,0.7
Oruthavanga mêla viswasam kadurathukaka en inoruthara asinga paduthuringaaaaaaaa best ever dialogue thala,Positive ,2,0.3333333333333333
I set your screens on fire Thalaivaaaaaaaaa,Negative ,0,0.7142857142857143
Ayyo yepdida ipdilam yappa marana mass da sama veriya iruken nalla thramana sirappana padam paka,Negative ,0,0.13333333333333333
6 days ah srilanka la trending 4 kulla thaan itukku,Positive ,2,0.3
Diwali winner Kaithi Like Bigil Cmt,Negative ,0,0.3333333333333333
Climax dance ultimate thaivar kaaga waiting vaa thailaivaa pongalukku ponga vachiruvam,Positive ,2,0.45454545454545453
HiNdI version,Negative ,0,0.5
Verithanam trailer nampa education mattum nampa keta irunthu yarum vanga mudiyadhu True words,Positive ,2,0.3076923076923077
6 o clk la irunthu continuous parthute irukuravanga like ah potutu ponga,Positive ,2,0.5
92k views but 142k likes how is it possible exploding head shocked face with exploding head exploding head shocked face with exploding head,Positive ,2,0.5652173913043478
Thalaivaaaaaaaaaaa Semma mass Pongal ku theatre summa aththirrrrum,Positive ,2,0.125
Isse 1000000 times better h zero ka trailer,Negative ,0,0.75
Sk masss vera lvl trailer,Positive ,2,0.4
petta in malayalam means badass and kaali is,Positive ,2,0.375
vijay sethupathi anna ku trailela seriyana scene ila vijay sethupathi anna ku innum mass scenes irukanum movie la,Positive ,2,0.3333333333333333
Ennagada 81k views 97k likes,Mixed_feelings ,1,0.0
Movie Vera Level Sir 100 True naan unmayilaye mersalayitten Ozm movie,Positive ,2,0.5454545454545454
so bollywood is 70 years behind hollywood,Negative ,0,0.42857142857142855
Enna Da Bomma padam maathiri irukuthu,Positive ,2,0.16666666666666666
Thala thala thala va aaaaaa vaaaaa thala Love youuuuu so much Thalaaaaaaaaaaaaaaaaaaaaaaaaaaa,Positive ,2,0.25
1 37 This scene matum 10times mela paathvangaa yaarelam,Positive ,2,0.3333333333333333
Padam verithanam nu solranvanga like pannunga,Positive ,2,0.3333333333333333
KK na yaaru Kamal and Kenny,Positive ,2,0.3333333333333333
Thala neenga Trending no 1 laye thangiteengala,Positive ,2,0.14285714285714285
All the best from rocking star Yash fans karnataka,Positive ,2,0.6666666666666666
Dislike potavanuka amma va oda vittu okanum,Negative ,0,0.42857142857142855
Dialogues nachu nachunu Vera levela erukku,Positive ,2,0.16666666666666666
DHANUSH FANS LIKE HATERS OF DHANUSH COMMENT ANY WAY BLOCKBUSTER FILM OF 2019 ASURAN,Positive ,2,0.7142857142857143
Sridevi Daughter Khushi Kapoor Met Ajith,Positive ,2,0.3333333333333333
Thala semma Meratitinga Thala love u,Positive ,2,0.3333333333333333
Trailer mokka da karthi punda magane,Negative ,0,0.3333333333333333
Pongalukku enna panna porom Petta parkaporom,Positive ,2,0.0
Itho vanthutanga athuku like podu ithuku like podu nu,Positive ,2,0.3333333333333333
Savage Oruthar mela neega vishwasam katradhuku inoruthara yen asinga paduthuringa,Positive ,2,0.3
Aiyoo thala Aug 10 varaikum wait pannanumey Nee vaa thala,Positive ,2,0.2
Nerkonda PAARVAI Trailer Vera level SEMMA MASS,Positive ,2,0.5714285714285714
You kena tunggu lebih lama lagi untuk tau saya Chiyaaannnn Vikrammmm,Positive ,2,0.36363636363636365
Elaam Avan seyal part 2 vaaa,Negative ,0,0.16666666666666666
Enakenumo like Kaala padam maari than thalaivaruku set agumonu thonudhu,Mixed_feelings ,1,0.3
Shankar sir ur a legend,Positive ,2,0.8
Thala Yoda last dialogue sema mass vera leval,Positive ,2,0.5
Rangaraj pandey FANS hit like here,Positive ,2,0.5
VA Thalaiva a style you are a massive style king love you,Positive ,2,0.8333333333333334
Rajini sir marana mass I am thalapathy veriyan,Positive ,2,0.5
Thala a sami I am wit,Positive ,2,0.6666666666666666
i am dhanush veriyan da mass vera level,Mixed_feelings ,1,0.875
Editing average ah iruku hope movie la paakumbodhu nalla irukumnu,Positive ,2,0.5
Kola gandula irrukuken mavaney kollama vida maten mass Thaliava,Positive ,2,0.2222222222222222
Yen sir arasiyaluku vantheenga ungala mulusa rasika kooda mudila You are a great actor,Mixed_feelings ,1,0.5
Theme song same like thala nerkonda paarvai thinking face thinking face,Negative ,0,0.7272727272727273
Ipo trailer pakkuravunga like pannunga 2 04 am,Positive ,2,0.375
Vera level I am dhanush big fan,Positive ,2,1.0
Mr Vandu Court la ipdilam kaththa kudathu,Negative ,0,0.2857142857142857
Mass Patta Rajini sir,Positive ,2,0.75
trending 1 in singapore superstar maaaass marannna maaasss,Positive ,2,0.125
44k dislikes verithanama kaathu kedanthurupanunga pola But 530k likes ithukku munnadi antha 44k dislikes Kaanaama poiduchi,Positive ,2,0.0625
I love vjs,Positive ,2,0.6666666666666666
Thala orutharukku thaa like vera yarukkum eilla thala tha,Positive ,2,0.3333333333333333
Super super RAJINI makkal mandram Tiruppur district DHARAPURAM,Positive ,2,0.375
Ellam avan seyal part 2 va,Positive ,2,0.16666666666666666
Evalo Peru pink Trailer parthinga like podunga,Positive ,2,0.42857142857142855
Super star chitti rockzz,Positive ,2,0.5
Enna pa bat man ah,Positive ,2,0.8
Mass ah ellama mechured ah actpanirukaru thala ana athuve bayangara mass ah erruku,Positive ,2,0.46153846153846156
Vetrimaran standard ku illadha madhiri iruku,Negative ,0,0.16666666666666666
Kanmadham cinemayile manju chechiye orma vannavar undo Love from Kerala,Positive ,2,0.3
Marana mass trailer 6 appuram 7 da namma super star munnadi yavanda ore star athu super star,Positive ,2,0.5294117647058824
Neraiya neraiya neraiya masssss ah irukku,Mixed_feelings ,1,0.16666666666666666
Super thalaiva Nee mass dha eppavume,Positive ,2,0.6666666666666666
Sema vera level ma Love u so much,Positive ,2,0.875
Enikikulla 10m agunnu naikiravaga like podunge,Positive ,2,0.16666666666666666
Kaththi poojai maari Bigil kaithi hit aagum,Mixed_feelings ,1,0.14285714285714285
Kozhandhaila vellaya iruparam valandha karupa iruparam idhudhan avaroda super power ah indha logic ah epo da mathuvinga,Negative ,0,0.35294117647058826
Vijayku competition ah vittu jeicha paathiya Anga nikkura,Mixed_feelings ,1,0.25
1 19 teejay,Positive ,2,0.0
Sk anna arjun sir mass nice trailer super vetri pera namma team ku vazthukkal,Positive ,2,0.5714285714285714
Chiyaan Mass ka Baap Agree,Positive ,2,0.6
My all time favourite Hero sk Anna smiling face with 3 hearts smiling face with 3 hearts,Negative ,0,0.7647058823529411
Thalaivar epovum mass dha sk anna love u anna,Positive ,2,0.6666666666666666
srilanka vijay veriyan da,Positive ,2,0.25
Shankar hatsoff to you sir,Positive ,2,0.6
Older me engineer aganum miss Me know Yedhuku engineering padicheyno,Mixed_feelings ,1,0.7
Trailer semma Next Thalapathy movie ipdithan mirattal ah irukapoguthu,Positive ,2,0.4444444444444444
Thala vera level Innum nariya nariya naraiya venum,Positive ,2,0.25
vivasam laa avlotha ippo petta tha mass,Negative ,0,0.2857142857142857
Trouble treat makkal selvan fans like it,Positive ,2,0.5714285714285714
Oruthar mela neenga viswasam katrathukaga innoruthara yan asingapaduthuringa Love you Thalaaaa,Positive ,2,0.36363636363636365
Pink nu hindi la vantha thoda tamil remake ah,Positive ,2,0.5555555555555556
tom and jerry ethinna kallum kollam,Negative ,0,0.3333333333333333
Oru periya nadigarukku indha padam set Aagadhu I think vera,Mixed_feelings ,1,0.4
Last dialog mass varaleval thala YSR music varaleval thala,Positive ,2,0.3333333333333333
Trailer pakrathuku munadiye like potavanga hit like,Negative ,0,0.5714285714285714
U1 bgm pedichavanga like panuga,Positive ,2,0.2
Paakaruthukku style aarukka Antha ponnukku kannu yengey kundiyiley vechirikkeyaa,Positive ,2,0.1111111111111111
Nerkonda paarvai Mix with Viswasam BGM,Mixed_feelings ,1,0.3333333333333333
Bgm kaga mattum repeated mode ah paakuravangala yar yar sollunga,Positive ,2,0.5
Yana sola mara massu kudu paru na nanikavala bgm vara level I love dhanush Anna,Positive ,2,0.6
TONIGHT KULLA 10 MILLION VIEWS KANDIPA VARUM AGREE,Positive ,2,0.375
Zero Movie Ki To Vaat Lagne Wali he,Negative ,0,0.625
Epavume ajith oda own dialogue padathula pota padam flop tha paapom director sona mari nadichurukara ila ivarukaga kadhaiya mathirukangala nu,Mixed_feelings ,1,0.35
Saavuradha irundhalum sanda potu saavanum Bayandhu saaga Koodadhu Apt for Diwali Release scenario,Positive ,2,0.3076923076923077
Ena pa Sollama kollama Posukunu release pannittinga,Mixed_feelings ,1,0.2857142857142857
petta paraaak watching the trailer continuously Marana massssss RAJINISM da Pongalku tharamaana sirapaana sambavam,Positive ,2,0.35714285714285715
Thalaiva Your Veera Level Marana Mass,Positive ,2,0.5
thanga tamil mannan enga thala daa,Positive ,2,0.16666666666666666
2 18 sweet sapda porom semma thalaiva blur background arumaiyaana edit,Positive ,2,0.36363636363636365
Seeman annan in mind voice Yaarya nee Enakke unna paakanum pola irukke,Positive ,2,0.3333333333333333
Padathoda cg pathi pesunavankaluku sariyana adi,Mixed_feelings ,1,0.0
Aiyo sami antha dance movement kevalam da sami Sirupa adakka mudiala rolling on the floor laughing rolling on the floor laughing,Positive ,2,0.6190476190476191
