text,category,label,proportionEnglish
All OK but Indha soori koothiyan dhan problem mokka joke koothiyan,Mixed_feelings ,1,0.45454545454545453
Isaac Asimov peranda Sundakka size suuranda,Mixed_feelings ,1,0.16666666666666666
Padaum vera Laval irukka pokuthunu nenikkaran,Mixed_feelings ,1,0.16666666666666666
BIGIL like KAITHI comment Sangathamizhan dislike,Mixed_feelings ,1,0.5
Hit like world wide Rajini Sir Fans,Positive ,2,0.7142857142857143
It looks like funny video game,Negative ,0,0.8333333333333334
Evanavthu pongal ku varamari iruntha apdiye odidu Varathu Thalaivar Hope viswasam and petta as BLOCKBUSTER,Positive ,2,0.26666666666666666
1 37 Nee Vaa Thala Mass,Positive ,2,0.3333333333333333
Thala yuvan vera level waiting laye veri yerudhu,Positive ,2,0.5
Karthik subburaj v believe i u ya so pls save us and Thalaver,Positive ,2,0.6923076923076923
Are you virgin Thala,Positive ,2,0.75
Thala da marana mass trailer,Positive ,2,0.6
0 45 Kutty moonchi unakennappa vaailaye rose vechiruppa,Mixed_feelings ,1,0.125
Hope this is not like Viswasam thinking face thinking face,Positive ,2,0.9
Omalla mass u da Gethu da,Positive ,2,0.6666666666666666
Indha cinemaavukkaaha sollala sinna paya makkaa SINDHIYUNGAL Andha oruvandhaanda Seeman adha payan padithikka solraangha puriyudhaa thamizha,Negative ,0,0.0
Awesome movie mass aa irruku vikram acting mass I am big fan of vikram,Mixed_feelings ,1,0.7857142857142857
Last punch sema thala dialogue super thalaaaaaaa,Positive ,2,0.5714285714285714
Ippo purithu Thalapathy yan lokesh ta chance kudutharunu,Positive ,2,0.375
Koiyala enna style Da thalaivar pinara Thalaiva,Positive ,2,0.2857142857142857
semma mass super star nenga vera level sir,Positive ,2,0.75
Thala veriyana irunthal like comment podunga,Positive ,2,0.3333333333333333
Why like kuduthuttu thirumbi vanthu paatha like pottathe kaamikkala,Positive ,2,0.3333333333333333
Super vettri maran nalae gaethu dhan,Positive ,2,0.3333333333333333
U1 u r vera level bro,Positive ,2,0.6666666666666666
Kaithi miga periya vettri vazthukal behalf THALAPATHY fans,Positive ,2,0.125
Story belong to Devandra kulam vellalar,Negative ,0,0.5
Batman belike yennada panni vechurukinga,Positive ,2,0.2
Semaya irukku fulla night liye eduthurukkanga I am waiting,Positive ,2,0.4444444444444444
Movie mass apro trailer pakkuravanga like pannunga,Positive ,2,0.5714285714285714
Thalaivar superstar legendary legend Rajini sir aatam aarambam,Positive ,2,0.375
National award kedikum nu nenikirivinga like podunga,Positive ,2,0.5714285714285714
Semma thalaivaaaaaaa I love u ma a I m wait this asuran smiling face with 3 hearts smiling face with 3 hearts,Mixed_feelings ,1,0.7727272727272727
Music Adichu Udaikkuthu Anirudh,Positive ,2,0.25
Karthi sir look like first movie yuganiki okkadu ALL THE BEST sammaya iruke,Mixed_feelings ,1,0.6153846153846154
asuran mari lam asuran than dislikers lam movies pakuratha vitutu vera vela poi parunga,Positive ,2,0.42857142857142855
Video pathutu comment pakka vanthavanga matum like Pannuga,Positive ,2,0.375
Neraya neraya neraya neraya nerayaaa maaaass all the best team,Positive ,2,0.4
3d LA pathapuram than solla mudium ippa cartoon videogames mathirithan iirukku,Mixed_feelings ,1,0.2727272727272727
Thala innaikutha enakku theirum trailer vanthathu,Positive ,2,0.16666666666666666
Sooper Pettai Trailer S Bajrangi Baaijaan film la Nawasuddin Siddiqi comedy police pettai la villain aa,Positive ,2,0.5625
Thala Thaladan da super thala veri,Positive ,2,0.5
Padam block buster ippovae unga dairy la ezhudhi vechikonga makalae,Mixed_feelings ,1,0.4
Padam mokkai ya dhan iruka poguthu en na adhula ajith act pannuradhunala,Negative ,0,0.4166666666666667
Superb teaser Malayalees like adi,Positive ,2,0.6
That sakthiman scene nanum kinathu kuilla velunthuruken sakthiman kapathuvarunu,Positive ,2,0.2222222222222222
As same as pink Dialogues alsi,Positive ,2,0.6666666666666666
Indiaka hi nahi world kabhi Record brock hone wala h Like karo jo jo aisa chahta h,Negative ,0,0.6470588235294118
Ayyyyyyyyyo movie semma kandippa periya maaaaaaaaass hittttttttu,Positive ,2,0.14285714285714285
Dislikes pottavan ellam kujith aamai ammava ookuga kusuvam thukkudurai valga,Negative ,0,0.0
Viswasam bgm mathri iruku konjam enaku matum dha andha feel irukooo,Positive ,2,0.18181818181818182
Srk khan movie zero best tairlor,Positive ,2,0.6666666666666666
adengapa innum nooru varsam alnalum thalaivar gethu than poga,Positive ,2,0.1111111111111111
Engada kanum enga thalaivana Vijay Sethupathi engal makkal selvatha kanum appuram enna maythukku ithu,Negative ,0,0.0
Indha maadhri dhairiyasaalinga eppayaachu dhaa porappan avana payanpaduthikravan dhaan buthisaali Well said Our Dhanush vetrimaraan combo is an example of this,Positive ,2,0.42857142857142855
Ithuthaan thalaivar padam Thalaivar mass Romba nalaiku appuram oru tharamana Rajini sir parthuruken,Positive ,2,0.15384615384615385
Enna bha trailer starting la Marvel lam varuthu,Positive ,2,0.625
10 vatti parthuten Thalaivar style ah parkkave Mass thalaiva Music nalla irukku,Positive ,2,0.3333333333333333
October release Aa November aachu daaa,Negative ,0,0.3333333333333333
Matha movie vida super ahh erukum nunanaikaren,Positive ,2,0.2857142857142857
karthik suppuraj ni theivam ya sonnatha senjita ni thalaivar veriyan,Positive ,2,0.3
Sankar sir ki oka like please,Mixed_feelings ,1,0.6666666666666666
Oruthar mela visvasam katrathanala innorthar yen verukirigga Thala rocks,Positive ,2,0.2222222222222222
Oru varshathuku 10 padam edukura mudhal hero,Positive ,2,0.14285714285714285
Asuran movie vetri pera congratulation to thala fans,Positive ,2,0.375
Super thalaiva super Unna eppadi pathu ronba nalachi Weldon karthik suppuraj and petta team,Positive ,2,0.2857142857142857
Akshara Hasan Acting is not ur thing SERIOUSLY,Negative ,0,0.875
Shakthi man nu sonna udane 90s kitnu niyabgham vanthavangha hit like,Positive ,2,0.36363636363636365
Feel like yalam avan seiyal movie let see valthukal,Negative ,0,0.5555555555555556
Petta semaya poingudhu poingalukku sweet tha,Positive ,2,0.3333333333333333
Endrum engala oraee Superstar ne than thalaivaaaaa,Positive ,2,0.2857142857142857
Romba nal aparam ajith ah normal ah pakaran siva oda build up illama tharamana trailer,Positive ,2,0.5333333333333333
Sema na inime sk fan,Positive ,2,0.4
Thalaivar varoporaar Jonjo odhingiru odi padhungiru varadhu thalaivar PETTA PARAAK,Positive ,2,0.0
chinna pasanga kuda imaiyamalai yen compare pandringa,Positive ,2,0.2857142857142857
Kaithi vs Bigil vs SangaThamizhan,Positive ,2,0.0
Super Talwar Chiyaan Vikram Marana mass,Positive ,2,0.5
Viswasam sirutha Siva senjitaan who agree rolling on the floor laughing rolling on the floor laughing,Negative ,0,0.8125
Thalaivar than massss evanalum Thalaivar itathai pitikka mutiyathu,Mixed_feelings ,1,0.125
2 18 it reminds murattu kaala s rajini,Positive ,2,0.25
Thalaiva ungaluku vayase ahala thalaiva marana mass thalaiva waitinglaye veriyahuthe,Positive ,2,0.1
Enth look aado oru raksha ella,Positive ,2,0.16666666666666666
Bgm kagava padathuku ponnum da yeppaaaaaa,Positive ,2,0.16666666666666666
1m likes vara varaikum very thanama than irupen,Positive ,2,0.375
Viswasam trailer enga daaaww Kola veri la irukan,Positive ,2,0.5
What ah speech Thala Ajith Kumar,Positive ,2,0.5
Keladu punda magan ali punda ajith,Negative ,0,0.0
Loving it is it going Hindi,Positive ,2,0.8333333333333334
Super ultimate star thala Ajith Kumar,Positive ,2,0.5
petta paraak last black shirt theriii thalaivaaa,Negative ,0,0.42857142857142855
Vetri Dhanush GV Prakash Trumpet BGM,Positive ,2,0.3333333333333333
3dla paakamalae ivlo nalla iruku appo 3Dla epdi irukum,Mixed_feelings ,1,0.0
thala sila per kasukaga yendha kadhayaiyum choose panni nadikuranga nee mattum dhan thala samuthayathu kaga nadikiringa vera level trailor,Positive ,2,0.3157894736842105
Kaithi Padam paathuttu nallarkkunu solravanga mattum like pannunga,Positive ,2,0.125
ee myran enthoru fans power aadey,Positive ,2,0.16666666666666666
Siva Anna super put not important,Mixed_feelings ,1,1.0
Super super super tala tala tala,Positive ,2,1.0
thalaiva neenga eppoyem super star tha massss,Positive ,2,0.42857142857142855
Padam na idhu padam mass,Positive ,2,0.4
Knjam body maintain panna inum nalla iruparu,Mixed_feelings ,1,0.2857142857142857
ultimate star thala fans like panunga,Positive ,2,0.5
Theme music visvasam konjam pidsuru thattuthu marrijavan ku mattum case pottinglaa ithukkum podunga da,Positive ,2,0.2857142857142857
Thalaaaaa Semma trailer new avatharam Ajith Sir,Positive ,2,0.42857142857142855
Trailer Ku teaser paravala nanaikuravaga oru like poduga,Negative ,0,0.375
Thala fanz lam yenga poniga comments low ah agudu,Positive ,2,0.3333333333333333
Irumbhuthurai maari indha movie super block buster agumnu solluravanga like here,Mixed_feelings ,1,0.5454545454545454
Apadiyalam nadakathu nadakavum kodathu mass scene,Positive ,2,0.3333333333333333
Innum neraya neraya nerya neraya views varanum Thala Rock,Positive ,2,0.1111111111111111
Love ajith from andhra pradesh karnataka,Positive ,2,0.3333333333333333
Intha mari pongalku la apdi tha nadakum Apdila nadakathu nadaka kudathu love you thala,Positive ,2,0.2857142857142857
Eppadi Neraya Nereya Neraya THALA Sollum bodhu gooshbumbs ah Eruku I love thala only,Positive ,2,0.2857142857142857
24k Potta pasanga vandhu paathutu poirkaanga,Negative ,0,0.0
Hey Vidya Bhalan engaya trailer full ah kanam,Positive ,2,0.625
Deiiii ennada panni vachi irukeenga,Positive ,2,0.0
3 Times kku mela pathavanga yarellam like pannunga,Negative ,0,0.375
I am andra ajith big fan bro,Positive ,2,0.5714285714285714
Intha dhesiya viruthu Award Asuranukku Than kandipla Mass Ah varom,Positive ,2,0.4
Avengers end game a keduthan ippa director pariu kuduka pooran,Negative ,0,0.4
Thalaivar enrum oruvar thaan avar Rajini Sir thaan,Positive ,2,0.125
11 maniku sollitu 10 30 ku vitanungaley,Positive ,2,0.0
Dai intha mari padam already neraya paathachu,Positive ,2,0.14285714285714285
Aama Mr Pandey inga enna panraru,Positive ,2,0.0
Apa kandipa thalapathy 64 miratta podhu,Positive ,2,0.16666666666666666
Vera level thalaivar tha eppavum mass,Positive ,2,0.6666666666666666
Innum one week trending la tha irrukanum,Positive ,2,0.5714285714285714
Oonkala ennaku pittikoum but romba thabana time la movie vittuthinka,Negative ,0,0.4
Sathiyama solren adichu underwearoda voda vitruven pona manam thirupi varathu,Negative ,0,0.0
Semma mass ahh iruku padatha release pannunga pa Wait panna mutiyaala,Positive ,2,0.36363636363636365
Bahubali 2 Vs 2 0 rolling on the floor laughing rolling on the floor laughing Rajamouli Vs Shankar Maragatha mani Vs A R Rahman,Mixed_feelings ,1,0.5416666666666666
Super super super rajani mass ssssssssssssssssssssssssssss,Positive ,2,0.6666666666666666
Again again trailer pathute commands padikuravanga oru like podunga,Positive ,2,0.4444444444444444
Evana pakka Chinna paiyan marri irukkan F girl,Positive ,2,0.25
Climax music kekkumpodhu appdiye goosebumps start aagudhu thanks Yuvan Annnnnnnnnnnnnna,Positive ,2,0.4
Pura aloga Chinta dhara ro cinema eta ku oscar trailer aka mili jiba kotha,Mixed_feelings ,1,0.2857142857142857
Thala king getha vaa thala un rasikargal irukkanga,Positive ,2,0.25
Trailer link ah Therinjavanga ellarukum share pannunga fans,Positive ,2,0.5
Hit like for Action King Arjun Sarja,Positive ,2,0.8571428571428571
Thalapathy fans yaaru nkp trailer pakka vantheenga,Positive ,2,0.14285714285714285
This is remake of pink hindi flim bigg boss abirami ka badhila tapsee ya vey potrkalam,Positive ,2,0.5625
Neraiya Neraiya Neraiya Neraiya Neraiya Thadava paathavunga Like Pannunga Bss,Positive ,2,0.1
Phaa Ithukey ipdinaaaa Namba thalapathy ku epdi irukummmmm Verithano verrithanooo,Mixed_feelings ,1,0.0
794k likes first remake trailer getting this likes,Positive ,2,0.625
Vijay sethupathi ma ma mass da,Positive ,2,0.6666666666666666
Screen play veramari iruku yedo iruku idula,Positive ,2,0.2857142857142857
More than 20 times paathavanga mattum like pannunga,Positive ,2,0.5
Rajini Rajini tha style style tha,Positive ,2,0.6666666666666666
Wow Ye kadavula parthuta Yeppo periya screen la pappanu marana waiting,Positive ,2,0.45454545454545453
Apdila nadakkathu nadakka kudathu lovely THALA,Positive ,2,0.16666666666666666
Suyama sindhika terinja ovoruthanum super hero mass ya yo,Positive ,2,0.5555555555555556
ayyo chance ah illa thalaivar acting pudusu pusa irukkupa vera yaarukum indha madri settagadhu adi poli merattitinga,Positive ,2,0.23529411764705882
Last dialogue its true Thala superb,Positive ,2,0.8333333333333334
en thalaivan engal thalaivan nija vaalvilum avarai paarthavudan en kastangal panjai parandhu poividukiradhu,Positive ,2,0.15384615384615385
Bgm ah enna da panni vachi erukega yelathuku semaah,Positive ,2,0.2222222222222222
Love u thalaaaaaaaaaaaaaaaa acting vera level Thala,Positive ,2,0.7142857142857143
Kola Gaandula irukken mavane odiru Phaah Dialogue delivery chancey illa,Negative ,0,0.3
rajini fans from Telugu states like here,Positive ,2,0.42857142857142855
Guyz support 2 0 India s pride,Positive ,2,0.42857142857142855
Views kammiya irukku yellaru parunga like pannunga 20m views avathu varanum 1m like varanum,Positive ,2,0.14285714285714285
Yaar Enna sonnalum Thala dhaan mass Inga neraya Peru Namma Poola Umbarathukune varanunga,Negative ,0,0.07692307692307693
All d best from all Kannadigas,Positive ,2,0.8333333333333334
Hollowed level la iruka rompa ethir pakkalam Vikram acting vera level,Positive ,2,0.45454545454545453
Hindi la amitabku fight illa Tamil Ajith ku la fight irruku,Positive ,2,0.36363636363636365
Ennada iron man elam vararu enya ildila pantringa ha ha,Mixed_feelings ,1,0.4
Thala oda lawyer acting ah pakka waiting ya,Positive ,2,0.75
100k like masss thala va va va va enum va,Mixed_feelings ,1,0.1
ajith fans kaaga dhan last dialogue,Positive ,2,0.5
Dai antha vijay cmku aasapaduran Aana en thala eppayumae mass da,Negative ,0,0.2727272727272727
Adei stop begging for likes Idiots,Negative ,0,0.5
Thala fans anaivarum oru like podunga,Positive ,2,0.16666666666666666
Namata kadu iruntha eduthukiruvanunga Namata Kasu iruntha pudingikiruvanunga Ana padipu mattum nammakitta irunthu eduthakavemudiyathu Powerful dialogue,Positive ,2,0.1875
Yenda Thalapathy fans poole nereya peru umburinge,Negative ,0,0.0
Hahaha poi bigil trailera paarungada face with hand over mouth smiling face with smiling eyes and hand covering mouth face with hand over mouth smiling face with smiling eyes and hand covering mouth vetti payalugala,Negative ,0,0.7714285714285715
amaiku sangu confirmed adai Siva ha ha ha apidiye Feb odi poidu Illa 10 paisa paaka maata,Negative ,0,0.35294117647058826
Deiii movie eppa da waiting laye veri aaguthu,Positive ,2,0.5
Thalaivan Verothanam Start Panntaru Indha Diwali Nammaldhu Thalaivaa,Negative ,0,0.125
Oruthar mela irukura visuvasathuku innoruthara yen asinga paduthiringa i think intha dialogue ellam fans kum suit agum,Positive ,2,0.35294117647058826
Sema pa trailer inum neraiya neraiya neraiya neraiya thadava paknum pola iruku,Positive ,2,0.16666666666666666
Thalaivaaa marana paa,Positive ,2,0.0
Amithapbachan padattai rajiniku piragu tala panrattu eppadi nenaikkiravanga like podunga,Positive ,2,0.2
Semma THALA veera leveal THALA,Positive ,2,0.0
Padam nalla irukum yenna siva direct seiyala aapppadi,Positive ,2,0.25
GREAT FILM BEST DIRECTOR WELL ACTOR MASS PRODUCTION,Positive ,2,1.0
Aiyoooo intha manusanuku unmaiyave age enna nu therila pa epadi irukaru Thalapathy fans verithanam,Negative ,0,0.21428571428571427
6 la irunthu 60 vara RAJINI RAJIAYAM,Positive ,2,0.2857142857142857
movie unlike adikunnadhu enthinanennariylla kandavarkkariyam movie ethra thrilling anennu,Negative ,0,0.4444444444444444
Ippo sila paithiyanga like or comment nu kelambi irukumea,Mixed_feelings ,1,0.4444444444444444
Ithu padam mathiri illa graphics mathiri irukku,Negative ,0,0.14285714285714285
Rajini nale mass than pa,Positive ,2,0.6
Dhanush Vetrimaaran GV,Positive ,2,0.3333333333333333
Mrg elunthathum bathroom pohama pakravanga like podathinga Poi velaya parunga,Positive ,2,0.3
thirunelveli enga thala yoda kotta daa,Positive ,2,0.0
Ena da trailer ye mokka pundai ya iruku,Negative ,0,0.5
Trailer maranna mass thalaivar therika vidrarruuuu,Positive ,2,0.3333333333333333
I hate v s Iron man kill it v s,Negative ,0,1.0
Rajini sir Teaser Super indha pongalukku Petta than gethu I like this Flim,Positive ,2,0.5384615384615384
Yaru padam vanthalum varadum thanush Anna padam vanthale tamil nade miratdum by thanush veriyan,Positive ,2,0.14285714285714285
Telugu dhanush fans hit like here,Positive ,2,0.6666666666666666
Rajini super star next c m 2 0 pe Super,Positive ,2,0.6
Rajini tha mass vj ajith lam tusu,Negative ,0,0.42857142857142855
Semmma maasss Thalaivar style Super thalaiva the horns sign of the horns the horns sign of the horns,Positive ,2,0.5555555555555556
Dhanush vatri maraan fans like it,Positive ,2,0.5
0 26 2 18 Goosebumps Onre Onru Mattam Thalaivar Rajni,Positive ,2,0.0
semma mass great Shankar sir super star rajini great,Positive ,2,0.6666666666666666
Our super hero siva anna forever,Mixed_feelings ,1,1.0
Intha acting ku thala ku Oscar award kadaikum,Mixed_feelings ,1,0.25
Endha trailer time sollamatte 200 time melle pathavange mattum like podunge,Positive ,2,0.36363636363636365
Nee enna captain America va,Negative ,0,0.4
Bigil Kaithi Yar yar 2 padathukume waiting,Negative ,0,0.42857142857142855
H VINOTH macha u athukkum mele,Positive ,2,0.5
G V Neenga music mattum pannunga thevaillama hero va nadikkathinga,Positive ,2,0.4
Thalaiva Makkal selvan Annan,Positive ,2,0.0
Ajith fans innum naraya naraya naraya trailer paakkanum,Positive ,2,0.125
Sammaya iruku Thalaya indha maari role la pakka dha nalla iruku romba naal kezhichi,Negative ,0,0.21428571428571427
Yuvan Shankar Raja Raja mean king you are the real bgm king Bgm Vera Vera Vera level yaa,Positive ,2,0.7222222222222222
bgm terikkuthu ghibran from 1 05,Positive ,2,0.16666666666666666
Semma style mass rajini is rock,Positive ,2,0.6666666666666666
Appadaaa Oru wela Thala Fans Siva kita irundu thappichitanga rolling on the floor laughing rolling on the floor laughing,Positive ,2,0.5789473684210527
Orutar mela visuwasam kaaturathukage innurature yen asinge paduturinge semmmmmaaaaaa,Positive ,2,0.2222222222222222
Neraya Neraya Neraya Neraya kola mass thala,Positive ,2,0.2857142857142857
tha VERA level Saavardha irundhaalum Poraadi saavanum Kaal la vizhundhu Saaga kudaadhu GOOSEBUMPS dailogue,Positive ,2,0.2857142857142857
Kaidhi oodha poran da vijay ku bhigilu va va va sanghu,Positive ,2,0.09090909090909091
Last dialogue semma karthi Anna Nala panirukenga,Negative ,0,0.42857142857142855
Itha trailer Ku dislike pannuraven girls ku against ta irupan pola You mom also girl,Positive ,2,0.4666666666666667
Theme pathutu thaan again paaka vanthan thala ya,Positive ,2,0.375
Enna Da Hindi a paarthu trailer I kooda copy adichi irukaanunga,Mixed_feelings ,1,0.45454545454545453
padam vera level hit aagum nu solravanga hit like here,Mixed_feelings ,1,0.7
Balaji shaktivel fans like ah poduga,Positive ,2,0.3333333333333333
Oruthar mele visvasam kattathukkake innoruthare yen asinga peduthirenge,Positive ,2,0.25
appo visuvasam lolzzzzz rombo pavam ajith lolzzzzzzzzzzzzzzzzzzzzzzzzzzzzzzzzzzzzzzzzzzzz,Negative ,0,0.0
savuratha irunthalum sanda pottu savanum sir payanthu kal la vilunthu sava kudathu sir super dialogue,Positive ,2,0.3333333333333333
Dislike potavangala tha neengala manusangala,Negative ,0,0.4
Fight scenes bgm vera level nu soiluravaga,Positive ,2,0.5714285714285714
Asuran vettai aramam marana mass,Positive ,2,0.2
Kamarajar ayya va tholvi adaiya vaitha tamilnadu thana ongkaluku last vara oru nalla thalaivar kuda vara mattan da,Negative ,0,0.2777777777777778
The word vera level thalaiva unaku vayase agadha paaaa,Mixed_feelings ,1,0.4444444444444444
Kola kandula irrukam veral level mass thalaiva,Negative ,0,0.42857142857142855
Ivaruku Intha vaisula agathu pola Omg wattta a man thalivaaaaaaa,Positive ,2,0.2
Thalapathy 64 kkaa vanthu intha trailer pathavanga vijay fans like podunga crossed fingers hand with index and middle fingers crossed crossed fingers hand with index and middle fingers crossed,Negative ,0,0.5517241379310345
Vagina fanskala savunkada Thalaivar Kodi parakura edathula Vera Evan kodida parakum,Negative ,0,0.18181818181818182
Nee va thala eppavum unaku viswasama irupom love you thala,Positive ,2,0.3
Aiiiii Black Sheep Ayaz kutty munji semme valthukal,Positive ,2,0.25
1st tym ungaal ipdi pakro Thala the horns sign of the horns the horns sign of the horns,Positive ,2,0.4444444444444444
Nerkonda parvai Sema sema sema trailer,Positive ,2,0.16666666666666666
en cmnta evanum mathika porathula so nice,Positive ,2,0.42857142857142855
Enagada ipdi padathula marana katu katirukinga,Positive ,2,0.0
congrats chiyaan Anna I m thala fan,Positive ,2,0.5714285714285714
Yenna da last seen ha phone la potrite mode la yedutha maari irruku,Positive ,2,0.6153846153846154
Bollywood wale yaha hagne na aye,Negative ,0,0.5
Vera Vera Vera level Umma,Positive ,2,0.8
copy bgm to malayalam film oppam,Negative ,0,0.5
omg Indian filmmaking is so embarassing xD,Positive ,2,0.2857142857142857
Petta padam vettri pera Thalapathy rasigargalin valltukkal Endrum vettriye todarum,Positive ,2,0.0
Mass thailava bgm Vera level and dialogues semma,Mixed_feelings ,1,0.5
Wow thalaivaaaa Vera Leval Teaser Awards Eduthu Vaikadaaa Asuran Vararuu,Positive ,2,0.3
Maranam dance thalaiva u r great,Positive ,2,0.6666666666666666
Enda en deivatha dislike pandringa thevudiya pasangala yaru sottula manna pottaru savungada prostitute pasangala,Negative ,0,0.2857142857142857
Thalaivar pongal begins the horns sign of the horns the horns sign of the horns petta paraak,Positive ,2,0.47058823529411764
Thalaivaa kola mass Vera leavel,Positive ,2,0.6
I don t know Tamil but I like Rajini Super style,Negative ,0,0.8181818181818182
Kola kandula irukan movanaeee kollama Vida matan,Mixed_feelings ,1,0.14285714285714285
semmmaaaaa massssss trailer a summa verithanam,Positive ,2,0.3333333333333333
Pink 73k likes only But NEER KONDA PAARVAI AWESOME,Positive ,2,0.5555555555555556
Dhanush vera maari idhu veri maari,Positive ,2,0.5
Yanada last la Bigil ku Reply pana maari irukayy rolling on the floor laughing rolling on the floor laughing,Negative ,0,0.6842105263157895
Sivakarthikeyan Anna real fan s her like,Positive ,2,0.8571428571428571
THALAIVAAAA VERA LEVEL YA,Mixed_feelings ,1,0.75
Nice smiling face with 3 hearts smiling face with 3 hearts But rekka Sindupath Mari irukama iruntha seri,Mixed_feelings ,1,0.5555555555555556
Last word in Malay you kena tunggu lebih lama lagi untuk tosai,Positive ,2,0.4166666666666667
Morning lindhu trailer pathuttu yavalo comment like pathutte erukravange like podunge,Positive ,2,0.45454545454545453
Dialog க ‌ல்வி mattum yaralum nammata eruthu aaduthuka mudiyathu Vera lvl,Positive ,2,0.09090909090909091
thalaiva unna paathona uyir poiyudichu yenna Mazz yenna class yenna style RAJINISM CONFIRMED,Positive ,2,0.23076923076923078
Thalaivar Veraaaaaaa level,Positive ,2,0.3333333333333333
Family yoda padam parka mudiyathu pola,Negative ,0,0.3333333333333333
Thala lookku sema mass nu soldravanga mattum oru like podunga,Positive ,2,0.3
Wow semmaya iruku sk anna fans hit,Positive ,2,0.42857142857142855
Peeta best or visuwasam best peeta best na like pannuga visuwasam best na dislike pannuga,Positive ,2,0.6
pongalukku petta paraak thaan thalaivaa back with bang,Mixed_feelings ,1,0.375
Omg thalaivaar pandey erukaraa vera level la eruku padam,Positive ,2,0.3333333333333333
Shraddha shrinath fans from Karnataka hit like here,Positive ,2,0.625
tvaivaal aaaa aaaaaa vera level tvaivaal aaaa,Positive ,2,0.2857142857142857
Vera level Trailer thala pola varuma luv u thala,Positive ,2,0.4444444444444444
Rajini Sir and Nawaz Bhai Can t wait,Positive ,2,0.625
Indha padam KGF vida semaiya irrukunu ninaykiravanga like podunga,Positive ,2,0.1111111111111111
Ennaa daa sedhukki vechirukkeenga frame by frame,Positive ,2,0.42857142857142855
After a long time Thalaivar look yeppaa semmaaa Vere leaveldialoge vere leavel anirudh bgm vijaysethupathi mass total petta kola mass doiii,Negative ,0,0.42857142857142855
Kola kandula irukan mavane kollama vidamatan hit like hera,Positive ,2,0.3333333333333333
Trailer merala aticithookuthu ellar vayil veralavaikuthu,Positive ,2,0.16666666666666666
Bgm na idhan bgm Yuvan on,Positive ,2,0.3333333333333333
Rissing Star SK eppavum Trending Star,Positive ,2,0.3333333333333333
Awesome Rajni na summa va,Positive ,2,0.4
unmiyana Thala fan like a potutu po,Mixed_feelings ,1,0.5714285714285714
Suyama sinthika therinjavan than MANITHAN super hero illa sk Ni seekrama anchoring ku again vara pora,Negative ,0,0.375
Super Shankar Sir Rajanikanth Sir All The Best Movie Team Waiting Movie From Pawankalyan Fans,Positive ,2,0.7333333333333333
தல ைவா Vera level Tha podra vediya,Positive ,2,0.42857142857142855
Paavam sk Anna last movie nalla pola intha movie hit aaganum ragavendhra swamy Kita vendikara,Negative ,0,0.3333333333333333
Yow editor trailer yeh mukkavasi story solitiyeya,Mixed_feelings ,1,0.5714285714285714
Sona time la trailer gethu bigil uuhhhuuuu sangu oothaaa,Positive ,2,0.3333333333333333
I m vetrimaran fan padam semma irukkum,Positive ,2,0.42857142857142855
Massss vera level ASURAN Panthayam adikum,Positive ,2,0.3333333333333333
Dhaush Nadipuku Intha padam Theeni podum nu ninaikuren,Positive ,2,0.125
Padam trailer mooka padamum waste Insulting amitab Poi sethu thola da ajith sunni,Negative ,0,0.38461538461538464
Really super epdiya ivlo irku 37 days la mudicha,Positive ,2,0.4444444444444444
Action king mass hero 1990s kids yarelam avanga solunga avaru mass ahh illaiyanu,Positive ,2,0.38461538461538464
Bgm sounds like Va modhi paru theme from Nerkonda paarvai,Positive ,2,0.3
