text,category,label,proportionEnglish
Vera director ah padam nalla irukum appo,Mixed_feelings ,1,0.42857142857142855
Padathu pathutu trailor pakura Evlo verithanam ebha,Positive ,2,0.0
Comment more more more more n fast fast fast,Positive ,2,1.0
Thalaaaaaa mass again after viswasm proud to be thalaaaaaa fan,Positive ,2,0.6
Ellam ok nalla than irukku aana ippe bigil kitte modhi thevai illame nalla padathe flop aakke porange,Negative ,0,0.11764705882352941
neraya neraya neraya neraya neraya neraya,Positive ,2,0.0
Kadaram Kondan south indian cinema Vendran engal chiyaan vikram,Positive ,2,0.2222222222222222
Adda adda da rajni sir rajni Sir da super superooooooo,Positive ,2,0.7
Inthaa year namaku 2 deepavali 2 pongal,Positive ,2,0.14285714285714285
No 1 trending again Vara vainga friends,Positive ,2,0.42857142857142855
kelatu punda makaluku oru nalathu panala suyanalavathi pundaaa mavan,Negative ,0,0.0
THALA I love you Marana Mass,Positive ,2,0.6666666666666666
I think it is same like pink movie,Positive ,2,1.0
Enaku apdiye padaiyappa second half Rajini ya patha mariye iruku can t wait for fdfs,Positive ,2,0.4666666666666667
Karumam Maari irukku Ajith oda dialogue delivery,Negative ,0,0.42857142857142855
Mass sk Anna vera level I love Anna padam vera levela irukkua poguthu,Mixed_feelings ,1,0.6153846153846154
Vikram Sir u r a pure fire,Positive ,2,0.8571428571428571
Tamil natla chiyan sir ahla mattum than ipadi hollywood range la nadika mudium ithu unmathanee,Positive ,2,0.26666666666666666
Epo trailer pathuttu erukinge like podunge,Positive ,2,0.3333333333333333
Semmmmaaaa masssss ss thalaiva Dialogue ella mirattal,Positive ,2,0.14285714285714285
Ennada ipadi yeduthu vechurkingha paaaaaaaaaph,Negative ,0,0.0
G V P paithiya kara nee mooditu Music eh podu Maallaaaaa Bgm,Positive ,2,0.5
GV prakash in Bgm padathuku extra strength,Positive ,2,0.42857142857142855
Sivakumar sir iruntha Ella phone ayum thativitu kathaya mudichirparu,Positive ,2,0.2222222222222222
Nammakitta kaadu irundha eduthukuvanunga rupa irundha eduthukuvanunga padipu irundha yavanalum edukamudiyadhu,Positive ,2,0.09090909090909091
Ennada ellam Avan seyal movie remake ka,Positive ,2,0.42857142857142855
No 1 trending in Sri Lanka,Positive ,2,0.5
Remake of pink Bollywood movie Yanna raaskala mind it,Negative ,0,0.6666666666666666
Rajinikanth and Akshay kumar Ke fans hit likes Superhit trailer,Positive ,2,0.3
What did you say Mrs Meera Krishanana Ippudi neryea Neryea Neryea,Positive ,2,0.36363636363636365
Shankar oru scientist nasa la work panna vendiya varu cinimala work pandraru,Mixed_feelings ,1,0.3333333333333333
Pakka mass is my super star,Positive ,2,0.8333333333333334
July1 20M vivews varum 1M likes um senthu varum,Positive ,2,0.1111111111111111
petta petta petta petta petta petta,Positive ,2,0.0
Eyyyyyy inda no1 no2 ellam paapa vilayattu ennakume thalaivar than no1 super one understand,Positive ,2,0.2857142857142857
Azalagana styleah na Rajini Remembering his love flims,Positive ,2,0.375
Thala August padam vatatum namma mass katrom,Positive ,2,0.2857142857142857
Karthick Subbaraj unmayana thalaivara veriyan nu katitinga great thalaivar Style la solnamna hats off karthick,Positive ,2,0.3333333333333333
Ena da apo apo viswasam theme varudhu,Negative ,0,0.2857142857142857
thala tha ennoda uyir daa ajith Anna neega vera leave,Positive ,2,0.4
Am thalapathy veriyan Anna asuranuku marana waiting,Positive ,2,0.42857142857142855
Vijay SK Mutual Fans Like pannunga,Mixed_feelings ,1,0.3333333333333333
Ipppadi neraya neraya neraya vera vera vera level,Positive ,2,0.5
Vfx work is Awesome like Hollywood movie,Positive ,2,0.7142857142857143
Thala vera vera vera level,Positive ,2,0.8
August la padam varatum Nama than gethunu kamikkurom,Positive ,2,0.375
Sorry pa Hollywood pakam vandite pola,Positive ,2,0.3333333333333333
1 trending in Srilanka 3 trending in Malaysia 9 trending in India,Positive ,2,0.25
Priyanka ellam avan seyal pola ullathu,Negative ,0,0.0
Super star ka super style,Positive ,2,1.0
Ithukkum dislike podravangala nenacha than,Positive ,2,0.4
nerkonda paruvai ipdi vaikkanum nalla Tamil Peruna,Positive ,2,0.0
Bigil ku pee pee ya oooooo oooooo,Negative ,0,0.42857142857142855
Enna da kadaisila kaththi bgm varthu,Negative ,0,0.16666666666666666
Orutharu mela viswasam katthurethu kaage yen ennoruthareh aasingam paduturingge,Mixed_feelings ,1,0.2222222222222222
Vera level la iruku Waiting for release,Positive ,2,0.8571428571428571
bgm kgf bgm modified mathiri iruku,Negative ,0,0.0
Tharamaama sambavam irukku 6 clock ku Kaathiruppom,Positive ,2,0.14285714285714285
Let s make the likes to 1 2 million likes,Positive ,2,0.6
Kaala na mass aah irukkanum Kaali na massum classsum irukkanum,Positive ,2,0.3
dislike potavanlam Setthuru summava Bigil team late release ku paechu vaarthai nadathinaanga Trailer therkidhu Sure shot saravedi,Negative ,0,0.4117647058823529
1m views 500k likes Now 4 6m views still 580k likes Something wrong,Mixed_feelings ,1,0.3076923076923077
This moive like Sri hari s Telugu movie Sri mahalashmi,Mixed_feelings ,1,0.6
Sk padam trailer ah vida ithu Semmiya Iruku,Positive ,2,0.25
Thala fans ellm trailer like pannunga bro,Positive ,2,0.2857142857142857
Rajini eh vaee sight adikaavechtangalaee he looks handsome makeupartist,Positive ,2,0.4444444444444444
Semma semma CG AND SEMMA BACKGROUND,Positive ,2,0.3333333333333333
Odi pathugiru vaarthu thalaivarin petta parak,Positive ,2,0.0
Bigil koodaye modhurapdi adhu Idhuthanda verithanam,Negative ,0,0.0
Naan oru thalapathy fan aanaa naan 100times mella paathirupan aaana likes views romba kammi,Positive ,2,0.07142857142857142
Love u dhanush anna semma massss,Positive ,2,0.6666666666666666
Bgm from 0 38 to 0 58 vere level,Positive ,2,0.3333333333333333
Thala time agiduchi kannu eriyuthu tomorrow vanthu ungalai parkkiren Thala I love you,Positive ,2,0.38461538461538464
Semma trailer paka mass,Positive ,2,0.5
Likes yaru vanguranganu mukkiyam illa box office than mukkiyam athula thalaivarae adika mudiyathanu pari right hit like,Mixed_feelings ,1,0.4117647058823529
National award miss aagathuu indha time,Positive ,2,0.6666666666666666
On fire thailaivar sirapana tharamana sambavangaka inime thaan pakaporinga,Positive ,2,0.2222222222222222
Crime side movie am love it RATCHASAN mathiri irukkunumnu aasapadraah,Positive ,2,0.6
Angali pangali anaivarukkum Kalai Vanakam,Positive ,2,0.0
adithya varma Kadaram kondan rendum onnukonnu salachathilla appavum pullayum kalakuraangale daily yar videova 1st pakrathunu doubt varum,Positive ,2,0.17647058823529413
Daiiii dislike poturanga koinjam pathutu potunga da,Positive ,2,0.2857142857142857
Teejay fans like here smiling face with 3 hearts smiling face with 3 hearts star struck star struck grinning face with star eyes star struck star struck grinning face with star eyes I love teejay songs,Positive ,2,0.7777777777777778
Yappa Vera level pa marana waiting,Positive ,2,0.6666666666666666
Thalaivaa Love uno words hyo paaaah star struck star struck grinning face with star eyes star struck star struck grinning face with star eyes the horns sign of the horns the horns sign of the horns,Positive ,2,0.6944444444444444
Oruthar maela viswasata kamika innoruta asinga padata kudadhu sema dialogue the horns sign of the horns the horns sign of the horns,Positive ,2,0.4090909090909091
Thala yoda ovevoru dialogue delivery um sema mass vera level Goosebumps overloaded,Positive ,2,0.5
viswasam Ku irundha opening iduku illa y thinking face thinking face still only 10 M viswasam trailer 14 M in one day edo onu miss aavudu,Positive ,2,0.5769230769230769
Neenga velayadanathu enkitta illa yeman kitta Only one dialogue is enough chiyaan uyir,Positive ,2,0.38461538461538464
super star king of kings forever,Positive ,2,0.8333333333333334
Nivetha suit aachu But rashi kanna nalla illa,Mixed_feelings ,1,0.25
Ellam avan seiyal nu oru padatha nyabaga paduthudu,Mixed_feelings ,1,0.125
Surya annan uyirr karthi annan chank,Negative ,0,0.16666666666666666
Simple Ah sollanumna Kola Mass Trailer Enna Acting ya manushan,Positive ,2,0.7
Ner Konda Parvai Thalaku Suitableana Title,Positive ,2,0.16666666666666666
Who all agree Vijay sethupathi ku inda mari dance set aagala nh,Negative ,0,0.4166666666666667
pollachi matar nakeeran kopal in sapot dialog,Positive ,2,0.14285714285714285
Pool maari irruku padam omna dhan podhu,Mixed_feelings ,1,0.2857142857142857
1 like nawaj bhai k liye,Positive ,2,0.3333333333333333
Thalaivar cinema la irukura varai avar thaan eppoum ennaikum Super,Positive ,2,0.3
Intha Super Star thaaan engaluku venum 90 s kids fav,Positive ,2,0.3
kochadaiyan football adraaru anga oru trailerla,Positive ,2,0.16666666666666666
1 40 enna harris bgm lam varudhu Therikkudhu Yuvan bgm,Positive ,2,0.1
Sarkar teaser record safe hugging face hugging face Naanga Telugu teaser and Hindi teaser potta neenga kaaaname poyivudum,Positive ,2,0.6111111111111112
Yo eth vand anyama erkk lle,Negative ,0,0.16666666666666666
Thala fan nu sollum pothu perumaiya irukku,Positive ,2,0.2857142857142857
appadiye ean channel ku oru sub podunga,Positive ,2,0.42857142857142855
Pls guys make it 1m likes,Positive ,2,0.3333333333333333
waннн waннн waннн тнala тнala тнala enge тнala nale мaѕѕ тan ѕeммeeee,Positive ,2,0.0
Yuvan Fans Hit Like,Positive ,2,0.5
Hero vera yar na podunga pa plz,Mixed_feelings ,1,0.7142857142857143
To haters in Lollu sabha style Arivu ketta eruma maadu,Negative ,0,0.3
Paah samma well known dialogue well said padippa yaralayum thirida mudiyathu,Positive ,2,0.45454545454545453
1 8 m reach sema eppadina 100m Vara vekkano,Positive ,2,0.3333333333333333
I love u thalaiva neenga eppavum mass nee va thalaivaaaaa,Mixed_feelings ,1,0.5
Thelivaaa marana mass ah iruku,Positive ,2,0.4
mass s INA ethu thanta thalaivaruta othunguta,Positive ,2,0.2857142857142857
Trailer nalla iruku padam nalla irukanum ambutu than solliputten,Positive ,2,0.2222222222222222
Thala mass yuvan bgm vera level suriya fan,Positive ,2,0.5
Dislike pottaven la ratham kakki saven,Negative ,0,0.3333333333333333
Sema trailer cinematography therikuthu bayangaramana oru mass plus thriller movie kaathuttu irukku,Positive ,2,0.5
Orutthar Mela viswasam kaadrathala Innorutthara Yan asinga paduthureenga Dai ungalathanda THALA THALAPATHY FANS,Positive ,2,0.15384615384615385
Rajani style is style style dance is dance,Positive ,2,0.875
Enna karumamda ethu cartoon padam mari erukuthu,Positive ,2,0.14285714285714285
Dey idhukku yenda dislike pandrinka Trailer semma mass ah entertaining ah thanae irukku vaitthu yerichallin uccham da neenka,Positive ,2,0.4444444444444444
Inime than sirappana tharamana sambavangala pakka poringa Best wishes for thalapathy fans,Negative ,0,0.25
ச ெம்ம ச ியான மரண Waiting for kadaram kondon movie,Positive ,2,0.3
Trailer 1million like varalanu yaarellam feel panringa,Positive ,2,0.42857142857142855
robot face robot face Thalaiwa is god Or Plz rajinikant sir ke fan ho to Touch to,Negative ,0,0.7647058823529411
Super man and Batman movie Mari iruku,Positive ,2,0.7142857142857143
Aapdilam nadakathu nadaka kudathu ultimate lines,Positive ,2,0.16666666666666666
Marana mass thala na thala tha,Positive ,2,0.5
Ending speech mass thalivaaaaaaakola kandula iruken,Positive ,2,0.5
0 48 0 49 thalaiva unakku vayasu 53 yaaa zany face grinning face with one large and one small eye zany face grinning face with one large and one small eye,Positive ,2,0.7096774193548387
Kaali Kaala Kaabali thalaivar da Kaa romba rasi nenaikuravaga like poduga,Positive ,2,0.18181818181818182
Paakathane poringa thalaivaroda maasa petta parak,Positive ,2,0.0
9m view innum neray neray neray view vennum friends,Positive ,2,0.2222222222222222
Always Thala Agalatheey pathutu Trailor pakuravanga like panunga,Positive ,2,0.25
Hindi movie pink Remake to tamil Good movie,Mixed_feelings ,1,0.75
Innum naraya naraya naraya views 10m pothathu,Positive ,2,0.0
Krish next part Tamil la padam yaduthurukanga super,Positive ,2,0.5
Style kingna athu yapovum thalaivar mattumthn,Positive ,2,0.16666666666666666
Graphics sari illa nu solrathukune oru gang suthum parunga,Positive ,2,0.4444444444444444
Nambukkitta kaadu eruntha eduthuppangha kaasu eruntha pudinguppanugha ana paddippa mattum epic dialogue,Positive ,2,0.25
2 02 kandipa naa varama cinema theatreruku unna pakka crossed fingers hand with index and middle fingers crossed crossed fingers hand with index and middle fingers crossed,Positive ,2,0.5925925925925926
Yenda KRISH maska copi adichi vachirukkinga face with monocle face with monocle Puthusa ethavathu design pannirukkalam,Mixed_feelings ,1,0.4375
Thala mass dialogue class vera level,Positive ,2,0.8333333333333334
Rajni Mass Pakkathana poringa Kali oda aathatha Sema Dialogue Old Rajni is back,Positive ,2,0.5384615384615384
35k Anil kunjus found disliked rolling on the floor laughing rolling on the floor laughing,Negative ,0,0.8
Trending list la irundu poi again trending la varadu First time seeing like this,Positive ,2,0.7142857142857143
kola gagdla irruken magane kollama vida matten Badsha 2,Positive ,2,0.1111111111111111
Thala pola varuma Thala eppavume mass Vera level,Positive ,2,0.375
marning eluntha undan nera nkp trailer parka vantha angaali pangaali ellaam oru like podunga,Positive ,2,0.21428571428571427
Thala masss yuvan bgm vera level,Mixed_feelings ,1,0.3333333333333333
Ide en inum trending la varla idha vda romba kammi views ruka videos lam trending la ruku,Positive ,2,0.29411764705882354
Sumara 50 times parthachu one more trailer plzzzz,Positive ,2,0.5
Enangada NKP theme music ah potu vachirukinga,Negative ,0,0.42857142857142855
Cast rajini nu pathil vera yarachum pannirukalam,Positive ,2,0.42857142857142855
Bigil vida indha trailer nalla irukae thinking face thinking face,Positive ,2,0.5
Nee engitta vilayaada la yeman kitta,Positive ,2,0.3333333333333333
Enna dhu Tamil cinema la vettu kutthu ilama oru padanum varatho,Positive ,2,0.2727272727272727
Paaandeeee padam paaka vanthuratha theater ku fst day,Positive ,2,0.25
Malayalam movie chinthamani kolacase njapakathukku varuth,Mixed_feelings ,1,0.16666666666666666
Really enjoyed ipotha thalaivaroda style nakkal ellathyum romba naaaluku aprm pakarom,Positive ,2,0.18181818181818182
Ippa inda SKfan ta enna solla poringa commenters,Positive ,2,0.125
Sk வ ுக்கு theme music வ ேண்டும் தல Yuvan Title BGM Semma,Positive ,2,0.25
Nee yaaravenalum iru evanavennaalum iru THALA kitta thaiyae iru,Positive ,2,0.1111111111111111
1 38 to 1 50 vera level,Positive ,2,0.42857142857142855
Tamil cinema la itha vida pudhu storyline Vera ethuvum kidayathu,Negative ,0,0.3
Karthi anna katta support from Kerala,Mixed_feelings ,1,0.5
Movie pathutu trailer paakuravangalaan like podunga,Positive ,2,0.5
Money money money neraya neraya neraya massss,Positive ,2,0.42857142857142855
Sl boys channel,Positive ,2,0.3333333333333333
Sema da Super machi FDFS confirmed,Positive ,2,0.6666666666666666
Rangaraj pandey fans hit like rolling on the floor laughing rolling on the floor laughing,Positive ,2,0.8
Aduchu Underwearoda odaa vitruvan to viswasam,Mixed_feelings ,1,0.16666666666666666
ajith sir super act but kadai puthikala,Mixed_feelings ,1,0.5714285714285714
Vera mathurii irukuuuu thalaivaaa Ni vah thalaivaaa vera Level expectations,Positive ,2,0.4
Trailer la vara scens lam kanom,Positive ,2,0.6666666666666666
Gotha like kuda vanga mudiyala neeyalam enga annan thalapathy compateator poda aamai kunjugala poi savunga da,Negative ,0,0.1875
Super star super star boos is bake,Positive ,2,0.8571428571428571
school boys innum tution pogala pola dislike button ah pudichu nonditu irukkanuga,Mixed_feelings ,1,0.3333333333333333
Soori illama iruntha movie supper hit,Mixed_feelings ,1,0.5
Kola gandu la irrikun padam paka,Positive ,2,0.3333333333333333
Indha teaser Ku dislike pana avaga amma silku da,Positive ,2,0.4444444444444444
Pandaee jii neega yepa padau nadika vantheenga,Positive ,2,0.0
I mena mukamudi padam mathiri iruku,Positive ,2,0.16666666666666666
Trailer eh pathute irukunum pola solravanga like podunga,Positive ,2,0.375
Vijay sethupathi ku nalla role illa pola Apo padam nallaa irukaathunu thaan ninaiken,Negative ,0,0.07692307692307693
Thungarthuku munnadi 1 time parpom,Positive ,2,0.2
Asuran hit aagum nu ninaikuravanga like panunga,Positive ,2,0.42857142857142855
30 million views varum nu soldravanga like potunga,Positive ,2,0.375
Yaaru da andha 9k dislikes uh,Positive ,2,0.16666666666666666
O my god i love you 2 0,Positive ,2,0.75
Kids like Sivakarthikeyan Legends like Action King ARJUN,Positive ,2,0.625
Supar movie Thala sema supar u1 Bgm nice,Positive ,2,0.25
Right now arun vijay in twitter yaru ellam superhero padam nadakirathunu vivasthai illamal pochu,Mixed_feelings ,1,0.35714285714285715
All thala fans comments pannunga 100k comments varanum,Positive ,2,0.125
Semma Padippu Mattu namma kitta erunthu etukka mudiyathu,Positive ,2,0.0
lets make it most liked video of youtube,Mixed_feelings ,1,0.625
Last scene vera level love u thala,Positive ,2,0.8571428571428571
Adaei idhu Johnny quest music ila,Mixed_feelings ,1,0.3333333333333333
Action king Arjun fans Like Here,Positive ,2,0.8333333333333334
Manushan epudi vanthalum tharama irukaru ya THALAAA This time CLASSY After a MASS VISWASAM,Positive ,2,0.5
sivakumar ah villana potruklam just miss,Positive ,2,0.5
Viswasam vs Petta pakalam yarru mass nu,Positive ,2,0.2857142857142857
U1 bgm Therikudhu Siva ku Nalla movie ya erukum cameramen George c villiams SEMA,Positive ,2,0.2857142857142857
Intha trailer ah daily pakaravanga,Positive ,2,0.6
Enna da ithu trailer ah Serial ah,Negative ,0,0.7142857142857143
Kerala ajit fans like ittu po ejjathi item Be ready makkale star struck star struck grinning face with star eyes star struck star struck grinning face with star eyes,Positive ,2,0.7241379310344828
Orutharmela neega viswasam MA erukarthuka Enaurutara a asigapadurega,Negative ,0,0.25
Oru Vela ellam avan seyal padam maathiri irukkumo,Positive ,2,0.125
Manju waarier looks like devashena u feel it guys,Mixed_feelings ,1,0.4444444444444444
Theatre la pakura alavuku worth illa suntv laye poduvan appa pathukuren,Mixed_feelings ,1,0.18181818181818182
Waste Moka nu solravanlam Moka pasanga moka movie paakuravanunga,Positive ,2,0.3333333333333333
Avara control panunga pls semmmmmmmmaaaa mass,Positive ,2,0.3333333333333333
Ethana per vanthalum CHIYAAN tha maasss,Positive ,2,0.3333333333333333
Very good film after long time,Positive ,2,1.0
Thalapathy fans irukingla dislike panra kaaga ve vandhavanga,Positive ,2,0.125
Amy Jackson pakka vanthaven la like podunka,Positive ,2,0.42857142857142855
Vera level trailer great job mr vinoth,Positive ,2,0.7142857142857143
tmrw film release inikum trailer pakka vanthavinka yaru,Positive ,2,0.375
Trending likes laam mukiyam Ila padamum acting yum dhan mukiyam theater la October 4 apo papinga,Positive ,2,0.25
Movie la ajithku theeni irukathu pola,Positive ,2,0.3333333333333333
Idha dhan pala varsham ah sollitu irukanga Ini otrumai ah irukanum ellarum Thala Thalapathy fans,Positive ,2,0.2
Trailor pakkum munnadi kooda onnu thonala trailor paatha aprm epoda paapomnu veri mandaikku eruthu This trailor Advance booking for awards,Positive ,2,0.25
1 40 Vjs Jithu Laugh Makkal Selvan Forever,Negative ,0,0.25
After release kaithi vera level diwali winner,Positive ,2,0.7142857142857143
As Neelambari said In Padayappa Vayasu analo un Stylum azhagum Une Vittu Pogala,Positive ,2,0.3076923076923077
vijay sethupathi nu oru nala actor irundhan ana avanum ipo poramboka maritan,Negative ,0,0.25
ENNA DAA ELLAA RECORDUKKUM SANGU OODIDUVAANGA POLA THALAIVAA SUPER,Positive ,2,0.1111111111111111
Ayayo bigil aprm release panratha idea iruka lokesh gaaru face with thermometer face with thermometer,Negative ,0,0.5333333333333333
Nee vaa thala namma therikka viduvoom,Positive ,2,0.16666666666666666
ada paavi appadiyae batman copy adichu vachirukingalae da,Positive ,2,0.375
Daii ellam likes me comment pannunga da,Positive ,2,0.42857142857142855
Thalaivar vera level karthik subbaraj yenagaya iruntha ivalo naala 02 00 Kola gaandla irukkam mavaney kollama vidda mataen insaneeeee P,Positive ,2,0.2
Video pakaraduku munadi like panta sama trailer,Mixed_feelings ,1,0.42857142857142855
OK expect panna levelku illa but ok,Positive ,2,0.2857142857142857
Siva sivan kjr hero trailer pakka Arjun arjunan ps hero mitran super Saktimaan sakti 90 kids like and comment,Positive ,2,0.47368421052631576
Elaam songs ku dhan addict aavaaanga Naa enna yaa trailer ku laam addict aaitan Can t wait,Positive ,2,0.47058823529411764
Semma semma semma semma thalaivar super star,Positive ,2,0.2857142857142857
Rajini sankar a kumar rahuman excellent job waiting on screen thalivar fan,Positive ,2,0.5833333333333334
Chinna payan konjam ovaru Ana trailer nalla irukku,Mixed_feelings ,1,0.25
Alaguuuuuuuuuuuuuuuuuuu my one and only superstar rajinikanth sirree,Positive ,2,0.625
Bgm evanda pottadhu dsp paiyana irupaan pola veenaponavan,Negative ,0,0.0
ivlo violence kandippa intha padathukku A certificate kodukkanum intha padatha yaaru thalaila katta poraano thaanu vaangura distributors ungalukku sangu thaandaa soothanmaa irunthukunga,Negative ,0,0.13636363636363635
Black sheep kutty moonji vivek fans hite like,Positive ,2,0.375
Orutharmela irukkura viswasatha kaatta innoruthara yen asingapaduthuringa Semma dialogue Verithanama waiting panren,Positive ,2,0.25
Bigil Left la poh Kaappaan Right la poh,Positive ,2,0.75
Vendum vendum asuran pola padam vendum Enpt vendam,Positive ,2,0.0
Sema BGM Semaya erukkum padam waitingle veri yeruthe,Positive ,2,0.125
Othaaaaa poooluu mari iruku Graphics,Positive ,2,0.2
V for vendetta dialogue An idea can t be destroyed,Positive ,2,0.9
VenkateshDaggubati74 Is Asuran Remake All The Best Venky Sir,Positive ,2,0.6666666666666666
OMG Thalaivar vera level Love you thalaiva,Positive ,2,0.5714285714285714
Gud thaan but Elam kolapura mathiri iruku,Positive ,2,0.2857142857142857
Katha than mukkiyam ana trailer semma,Positive ,2,0.6666666666666666
Ivaru tha hero mathavanka LA zero va title yosika therila Ivan kuda action king vera pathu ena nadaka pokutho,Negative ,0,0.42105263157894735
Omg Yarellam Thala Ya Pakka Wait Panninga,Mixed_feelings ,1,0.2857142857142857
Tik Tok Thala veriyan selvasaisaran,Positive ,2,0.0
Thalaivaaaaaa Ne matum than nadigan ne matum than super star,Mixed_feelings ,1,0.6
Vera Vera Vera level doi mass music Pakka,Positive ,2,0.75
Movie Tamil memang best terbaik Ajith,Positive ,2,0.3333333333333333
Video start aguradhuku munnadiye like poten Happy to see Prakash Raj sir back,Positive ,2,0.6923076923076923
Sweet saapda pooram pongal vera lvl la erukkum,Positive ,2,0.375
Views got stuck on 70k,Mixed_feelings ,1,0.6
Trailer marana mass FdFs poravanga therikkavidunga Saadha sk padam naale comedy yaathaan irukkum Anna ithu different script Next level Sk,Mixed_feelings ,1,0.4
Racha rambola tala luv u from hyd,Positive ,2,0.42857142857142855
Nerkonda Paarvai vs pink who is best,Mixed_feelings ,1,0.5714285714285714
58k dislike pottavan tha kadasi vasanthuku vekka padanum,Positive ,2,0.25
Ayooo Thala lv u Thala Sema mass Thala look Sema smiling face with 3 hearts smiling face with 3 hearts,Positive ,2,0.55
I like karthick subburaj direction karthick subburaj gets rocks,Mixed_feelings ,1,0.3333333333333333
Sure blockbuster Congrats from thalapathy fans Lokesh kanagaraj,Mixed_feelings ,1,0.375
Enga thalaivar eppavumme masss nu sollravanga mattum hit like pannitu ponga,Negative ,0,0.36363636363636365
Trialer super maran padam vettiri pera valthukal,Positive ,2,0.14285714285714285
Thala indha look la semaya irukkaru star struck star struck grinning face with star eyes star struck star struck grinning face with star eyes,Positive ,2,0.75
Rasanai illadha pullingow apdi enna korai ah kandu pudichitanga indha video lae dislike panra alavukku,Positive ,2,0.2
U1 tharamana sambavam aug 10 apa papinga,Positive ,2,0.14285714285714285
Enna da trending laye kaanom,Positive ,2,0.2
Rowdy ingala hero va katti vanmuraiya thundarady vetrimarnukku velaya pochi Yevlo Enda nattukku thevayana Nalla karuthukala vachi flim edukalamla,Negative ,0,0.10526315789473684
Thalaaa maranaaa masssss love u thalaaaa,Positive ,2,0.3333333333333333
Sad to say but seems like rekka 2 hope I m wrong,Mixed_feelings ,1,0.75
U1 bgm vera level thala vera level acting,Positive ,2,0.625
Scene like remake from hindi movie PINK,Positive ,2,0.8571428571428571
A MAGNUM OPUS FILM FI FILM MAKING IN ZERO BUDGET,Negative ,0,1.0
Intha trailer la neega like rajini kaga pada venna oru tamilan padaippu kaga podunga,Mixed_feelings ,1,0.21428571428571427
Unlike panradhukkune wait pannittu irundhurukkanunga 13k padunga,Negative ,0,0.2857142857142857
Thalaivar style la sollanum na trailer WOW,Positive ,2,0.7142857142857143
Oruthan mela visvasatha katrathu kaga innorthara asinga paduthuringa,Positive ,2,0.125
Enagada YouTube inum trending la add panama irukinga,Mixed_feelings ,1,0.375
Sema masss Rajini Vjs combo marana waiting,Negative ,0,0.14285714285714285
Objection enna voice paa marubadium pananum pola iruku,Positive ,2,0.25
Yarellam note paninga teejey movie la vandharunu thinking face thinking face,Positive ,2,0.6363636363636364
THALA always masss Ippo sollava venum U1 music vera level ah irukkum,Positive ,2,0.4166666666666667
En innum trending la varala Ennada panringa YouTube fellows,Mixed_feelings ,1,0.2222222222222222
Super video and super star mass,Positive ,2,1.0
Thala look Vera level LA eruku,Positive ,2,0.6666666666666666
Trending la namba Thala trailer thaa num1,Positive ,2,0.2857142857142857
Ranga Raj panday sir action super,Positive ,2,0.6666666666666666
Dhanush Anna vera level u look awesome,Positive ,2,1.0
Bollywood movie Pink remeke lol,Mixed_feelings ,1,0.4
Ajith Thalathala nu irukaru nalla gummunu,Positive ,2,0.16666666666666666
